{
  "$schema": "https://llm-catalog.example.cn/schemas/offering.schema.json",
  "schema_version": "1.0.0",
  "offering_id": "zhipu/glm-5.2",
  "provider_id": "zhipu",
  "canonical_id": "zhipu/glm-5.2",
  "api_model_id": "glm-5.2",
  "name": "GLM-5.2",
  "status": "active",
  "lifecycle": {
    "release_date": "unknown",
    "last_updated": "unknown",
    "status": "active",
    "deprecated_at": "unknown",
    "replacement": "unknown"
  },
  "protocols": ["openai_chat_completions", "anthropic_messages"],
  "limits": {
    "max_context_tokens": 1000000,
    "max_input_tokens": "unknown",
    "max_output_tokens": 131072
  },
  "modalities": {
    "input_modalities": ["text"],
    "output_modalities": ["text"]
  },
  "capabilities": {
    "agent": {
      "streaming": true,
      "stream_usage": "unknown",
      "system_message": true,
      "tool_call": true,
      "tool_choice": "unknown",
      "parallel_tool_calls": "unknown",
      "strict_tools": "unknown",
      "structured_output": true,
      "json_schema": true
    },
    "reasoning": {
      "supported": true,
      "modes": ["switchable", "effort"],
      "effort_values": ["none", "minimal", "low", "medium", "high", "xhigh", "max"],
      "budget_tokens": "unknown",
      "interleaved_reasoning": "unknown",
      "protocol_fields": {
        "openai_chat_completions": "reasoning_effort",
        "anthropic_messages": "unknown"
      }
    }
  },
  "sampling_parameters": {
    "temperature": {
      "supported": true,
      "range": {
        "minimum": 0,
        "maximum": 1,
        "minimum_inclusive": true,
        "maximum_inclusive": true
      },
      "official_default": 1,
      "protocol_mapping": {
        "openai_chat_completions": "temperature",
        "anthropic_messages": "unknown"
      }
    },
    "top_p": {
      "supported": true,
      "range": {
        "minimum": 0.01,
        "maximum": 1,
        "minimum_inclusive": true,
        "maximum_inclusive": true
      },
      "official_default": 0.95,
      "protocol_mapping": {
        "openai_chat_completions": "top_p",
        "anthropic_messages": "unknown"
      }
    },
    "top_k": {
      "supported": "unknown",
      "range": "unknown",
      "official_default": "unknown",
      "protocol_mapping": {
        "openai_chat_completions": "unknown",
        "anthropic_messages": "unknown"
      }
    }
  },
  "embedding": null,
  "evidence": [
    {
      "source_id": "zhipu-glm-5.2-model",
      "source_url": "https://docs.bigmodel.cn/cn/guide/models/text/glm-5.2",
      "source_type": "official_docs",
      "retrieved_at": "2026-08-02T00:00:00Z",
      "verified_at": "2026-08-02T00:00:00Z",
      "confidence": "high",
      "redistribution": "unknown",
      "notes": "用于模型 ID、OpenAI 路径、限额、系统消息示例和能力。"
    },
    {
      "source_id": "zhipu-core-parameters",
      "source_url": "https://docs.bigmodel.cn/cn/guide/start/concept-param",
      "source_type": "official_docs",
      "retrieved_at": "2026-08-02T00:00:00Z",
      "verified_at": "2026-08-02T00:00:00Z",
      "confidence": "high",
      "redistribution": "unknown",
      "notes": "用于 sampling 支持、范围、官方默认值、最大输出和 reasoning_effort。官方默认仅是元数据，不是运行配置。"
    },
    {
      "source_id": "zhipu-claude-compatible",
      "source_url": "https://docs.bigmodel.cn/cn/guide/develop/claude/introduction",
      "source_type": "official_docs",
      "retrieved_at": "2026-08-02T00:00:00Z",
      "verified_at": "2026-08-02T00:00:00Z",
      "confidence": "high",
      "redistribution": "unknown",
      "notes": "仅确认 glm-5.2 的 Anthropic Messages 接入；未展示的参数映射保持 unknown。"
    },
    {
      "source_id": "zhipu-structured-output",
      "source_url": "https://docs.bigmodel.cn/cn/guide/capabilities/struct-output",
      "source_type": "official_docs",
      "retrieved_at": "2026-08-02T00:00:00Z",
      "verified_at": "2026-08-02T00:00:00Z",
      "confidence": "high",
      "redistribution": "unknown",
      "notes": "用于核验 GLM-5.2 结构化输出/JSON Schema。"
    },
    {
      "source_id": "project-fde-head",
      "source_url": "urn:git:fses-design-mono:c88e5def41856e42449d52ed6d1b05e6fab09d12",
      "source_type": "project_audit",
      "retrieved_at": "2026-08-02T00:00:00Z",
      "verified_at": "2026-08-02T00:00:00Z",
      "confidence": "high",
      "redistribution": "restricted",
      "notes": "当前项目构造器消费路径审计。"
    }
  ],
  "field_annotations": {
    "/offering_id": { "runtime_effective": false, "metadata_only": true, "adapter_mapping": null, "unsupported_reason": null, "source_ids": ["zhipu-glm-5.2-model"] },
    "/provider_id": { "runtime_effective": true, "metadata_only": false, "adapter_mapping": "ChatOpenAI / ChatAnthropic adapter selection", "unsupported_reason": null, "source_ids": ["zhipu-glm-5.2-model", "zhipu-claude-compatible", "project-fde-head"] },
    "/canonical_id": { "runtime_effective": false, "metadata_only": true, "adapter_mapping": null, "unsupported_reason": null, "source_ids": ["zhipu-glm-5.2-model"] },
    "/api_model_id": { "runtime_effective": true, "metadata_only": false, "adapter_mapping": "ChatOpenAI.model / ChatAnthropic.model", "unsupported_reason": null, "source_ids": ["zhipu-glm-5.2-model", "zhipu-claude-compatible", "project-fde-head"] },
    "/name": { "runtime_effective": false, "metadata_only": true, "adapter_mapping": null, "unsupported_reason": null, "source_ids": ["zhipu-glm-5.2-model"] },
    "/status": { "runtime_effective": false, "metadata_only": true, "adapter_mapping": null, "unsupported_reason": null, "source_ids": ["zhipu-glm-5.2-model"] },
    "/lifecycle/*": { "runtime_effective": false, "metadata_only": true, "adapter_mapping": null, "unsupported_reason": null, "source_ids": ["zhipu-glm-5.2-model"] },
    "/protocols": { "runtime_effective": true, "metadata_only": false, "adapter_mapping": "ChatOpenAI / ChatAnthropic adapter selection", "unsupported_reason": null, "source_ids": ["zhipu-glm-5.2-model", "zhipu-claude-compatible", "project-fde-head"] },
    "/limits/max_context_tokens": { "runtime_effective": true, "metadata_only": false, "adapter_mapping": "current FDE model.profile.maxInputTokens (semantic mismatch)", "unsupported_reason": "不得继续把 context 当 input。", "source_ids": ["zhipu-glm-5.2-model", "project-fde-head"] },
    "/limits/max_input_tokens": { "runtime_effective": false, "metadata_only": false, "adapter_mapping": "DeepAgent model.profile.maxInputTokens", "unsupported_reason": "可靠值缺失，必须 fail closed 或显式 override。", "source_ids": ["zhipu-glm-5.2-model", "project-fde-head"] },
    "/limits/max_output_tokens": { "runtime_effective": true, "metadata_only": false, "adapter_mapping": "ChatOpenAI.maxTokens / ChatAnthropic.maxTokens", "unsupported_reason": null, "source_ids": ["zhipu-core-parameters", "project-fde-head"] },
    "/modalities/*": { "runtime_effective": false, "metadata_only": false, "adapter_mapping": "FDE role/content validation", "unsupported_reason": "当前只消费粗粒度 modelType。", "source_ids": ["zhipu-glm-5.2-model", "project-fde-head"] },
    "/capabilities/agent/*": { "runtime_effective": false, "metadata_only": false, "adapter_mapping": "ChatOpenAI/ChatAnthropic constructor and call options", "unsupported_reason": "当前 FDE 未消费细粒度 Agent 能力。", "source_ids": ["zhipu-glm-5.2-model", "zhipu-structured-output", "project-fde-head"] },
    "/capabilities/agent/tool_call": { "runtime_effective": true, "metadata_only": false, "adapter_mapping": "current coarse functionCallSupport admission gate", "unsupported_reason": "当前仅粗粒度生效。", "source_ids": ["zhipu-glm-5.2-model", "project-fde-head"] },
    "/capabilities/reasoning/supported": { "runtime_effective": false, "metadata_only": true, "adapter_mapping": null, "unsupported_reason": null, "source_ids": ["zhipu-glm-5.2-model", "project-fde-head"] },
    "/capabilities/reasoning/*": { "runtime_effective": false, "metadata_only": false, "adapter_mapping": "ChatOpenAI.reasoning or provider request fields", "unsupported_reason": "当前 FDE 未构造 reasoning 参数；Anthropic 映射未获官方证实。", "source_ids": ["zhipu-core-parameters", "zhipu-claude-compatible", "project-fde-head"] },
    "/sampling_parameters/*": { "runtime_effective": false, "metadata_only": false, "adapter_mapping": "three-layer policy merge then protocol-aware constructor filtering", "unsupported_reason": "当前 temperature/topP 已存储并下发但构造器未消费；Anthropic 映射 unknown 时不得发送。", "source_ids": ["zhipu-core-parameters", "zhipu-claude-compatible", "project-fde-head"] },
    "/embedding": { "runtime_effective": false, "metadata_only": true, "adapter_mapping": null, "unsupported_reason": null, "source_ids": ["zhipu-glm-5.2-model"] }
  }
}
