{
  "$schema": "https://llm-catalog.example.cn/schemas/offering.schema.json",
  "api_model_id": "z-ai/glm-5.1",
  "canonical_id": "z-ai/glm-5.1-20260406",
  "capabilities": {
    "agent": {
      "json_schema": "unknown",
      "parallel_tool_calls": "unknown",
      "stream_usage": "unknown",
      "streaming": "unknown",
      "strict_tools": "unknown",
      "structured_output": "unknown",
      "system_message": "unknown",
      "tool_call": "unknown",
      "tool_choice": "unknown"
    },
    "reasoning": {
      "budget_tokens": "unknown",
      "effort_values": [
        "unknown"
      ],
      "interleaved_reasoning": "unknown",
      "modes": [
        "unknown"
      ],
      "protocol_fields": {},
      "supported": "unknown"
    }
  },
  "embedding": null,
  "evidence": [
    {
      "confidence": "low",
      "notes": "仅记录 models.dev 直连条目 z-ai/glm-5.1（上游收录日期 2026-04-07）。该日期不是官方发布日期；未核验运行时能力、协议或请求模型标识。",
      "redistribution": "attribution_required",
      "retrieved_at": "2026-08-02T00:00:00Z",
      "source_id": "models-dev-2026-observation",
      "source_type": "upstream_aggregator",
      "source_url": "https://models.dev/models.json",
      "verified_at": "2026-08-02T00:00:00Z"
    }
  ],
  "field_annotations": {
    "/api_model_id": {
      "adapter_mapping": "ChatOpenAI.model / ChatAnthropic.model",
      "metadata_only": false,
      "runtime_effective": false,
      "source_ids": [
        "models-dev-2026-observation"
      ],
      "unsupported_reason": "仅有 models.dev 聚合记录；API 协议、真实请求模型标识和全部运行时能力均未获官方核验，默认不得发送。"
    },
    "/canonical_id": {
      "adapter_mapping": null,
      "metadata_only": true,
      "runtime_effective": false,
      "source_ids": [
        "models-dev-2026-observation"
      ],
      "unsupported_reason": null
    },
    "/capabilities/*": {
      "adapter_mapping": "capability-aware Chat adapter / DeepAgent admission",
      "metadata_only": false,
      "runtime_effective": false,
      "source_ids": [
        "models-dev-2026-observation"
      ],
      "unsupported_reason": "仅有 models.dev 聚合记录；API 协议、真实请求模型标识和全部运行时能力均未获官方核验，默认不得发送。"
    },
    "/embedding": {
      "adapter_mapping": null,
      "metadata_only": true,
      "runtime_effective": false,
      "source_ids": [
        "models-dev-2026-observation"
      ],
      "unsupported_reason": null
    },
    "/lifecycle/*": {
      "adapter_mapping": null,
      "metadata_only": true,
      "runtime_effective": false,
      "source_ids": [
        "models-dev-2026-observation"
      ],
      "unsupported_reason": null
    },
    "/limits/*": {
      "adapter_mapping": "runtime token-limit guard",
      "metadata_only": false,
      "runtime_effective": false,
      "source_ids": [
        "models-dev-2026-observation"
      ],
      "unsupported_reason": "仅有 models.dev 聚合记录；API 协议、真实请求模型标识和全部运行时能力均未获官方核验，默认不得发送。"
    },
    "/modalities/*": {
      "adapter_mapping": "FDE role/content validation",
      "metadata_only": false,
      "runtime_effective": false,
      "source_ids": [
        "models-dev-2026-observation"
      ],
      "unsupported_reason": "仅有 models.dev 聚合记录；API 协议、真实请求模型标识和全部运行时能力均未获官方核验，默认不得发送。"
    },
    "/name": {
      "adapter_mapping": null,
      "metadata_only": true,
      "runtime_effective": false,
      "source_ids": [
        "models-dev-2026-observation"
      ],
      "unsupported_reason": null
    },
    "/offering_id": {
      "adapter_mapping": null,
      "metadata_only": true,
      "runtime_effective": false,
      "source_ids": [
        "models-dev-2026-observation"
      ],
      "unsupported_reason": null
    },
    "/protocols": {
      "adapter_mapping": "Chat adapter protocol selection",
      "metadata_only": false,
      "runtime_effective": false,
      "source_ids": [
        "models-dev-2026-observation"
      ],
      "unsupported_reason": "仅有 models.dev 聚合记录；API 协议、真实请求模型标识和全部运行时能力均未获官方核验，默认不得发送。"
    },
    "/provider_id": {
      "adapter_mapping": "provider adapter selection",
      "metadata_only": false,
      "runtime_effective": false,
      "source_ids": [
        "models-dev-2026-observation"
      ],
      "unsupported_reason": "仅有 models.dev 聚合记录；API 协议、真实请求模型标识和全部运行时能力均未获官方核验，默认不得发送。"
    },
    "/sampling_parameters/*": {
      "adapter_mapping": "three-layer policy merge then constructor filtering",
      "metadata_only": false,
      "runtime_effective": false,
      "source_ids": [
        "models-dev-2026-observation"
      ],
      "unsupported_reason": "仅有 models.dev 聚合记录；API 协议、真实请求模型标识和全部运行时能力均未获官方核验，默认不得发送。"
    },
    "/status": {
      "adapter_mapping": null,
      "metadata_only": true,
      "runtime_effective": false,
      "source_ids": [
        "models-dev-2026-observation"
      ],
      "unsupported_reason": null
    }
  },
  "lifecycle": {
    "deprecated_at": "unknown",
    "last_updated": "unknown",
    "release_date": "unknown",
    "replacement": "unknown",
    "status": "unknown"
  },
  "limits": {
    "max_context_tokens": 202752,
    "max_input_tokens": "unknown",
    "max_output_tokens": "unknown"
  },
  "modalities": {
    "input_modalities": [
      "text"
    ],
    "output_modalities": [
      "text"
    ]
  },
  "name": "Z.ai: GLM 5.1",
  "offering_id": "z-ai/glm-5.1-20260406",
  "protocols": "unknown",
  "provider_id": "z-ai",
  "sampling_parameters": {
    "temperature": {
      "official_default": "unknown",
      "protocol_mapping": {},
      "range": "unknown",
      "supported": "unknown"
    },
    "top_k": {
      "official_default": "unknown",
      "protocol_mapping": {},
      "range": "unknown",
      "supported": "unknown"
    },
    "top_p": {
      "official_default": "unknown",
      "protocol_mapping": {},
      "range": "unknown",
      "supported": "unknown"
    }
  },
  "schema_version": "2.3.0",
  "status": "unknown"
}
