{
  "$schema": "https://llm-catalog.example.cn/schemas/offering.schema.json",
  "schema_version": "2.4.0",
  "offering_id": "openai/gpt-5.5",
  "provider_id": "openai",
  "canonical_id": "openai/gpt-5.5",
  "api_model_id": "gpt-5.5",
  "name": "GPT-5.5",
  "status": "active",
  "lifecycle": {
    "release_date": "unknown",
    "last_updated": "unknown",
    "status": "active",
    "deprecated_at": "unknown",
    "replacement": "unknown"
  },
  "protocols": ["openai_chat_completions", "openai_responses"],
  "limits": {
    "max_context_tokens": 1050000,
    "max_input_tokens": "unknown",
    "max_output_tokens": 128000
  },
  "modalities": {
    "input_modalities": ["text", "image"],
    "output_modalities": ["text"]
  },
  "capabilities": {
    "agent": {
      "streaming": true,
      "stream_usage": "unknown",
      "system_message": "unknown",
      "tool_call": true,
      "tool_choice": "unknown",
      "parallel_tool_calls": "unknown",
      "strict_tools": "unknown",
      "structured_output": true,
      "json_schema": true
    },
    "reasoning": {
      "supported": true,
      "modes": ["effort"],
      "effort_values": ["none", "low", "medium", "high", "xhigh"],
      "budget_tokens": "unknown",
      "interleaved_reasoning": "unknown",
      "protocol_fields": {
        "openai_chat_completions": "reasoning_effort",
        "openai_responses": "reasoning.effort"
      }
    }
  },
  "sampling_parameters": {
    "temperature": {
      "supported": "unknown",
      "range": "unknown",
      "official_default": "unknown",
      "protocol_mapping": {
        "openai_chat_completions": "unknown",
        "openai_responses": "unknown"
      }
    },
    "top_p": {
      "supported": "unknown",
      "range": "unknown",
      "official_default": "unknown",
      "protocol_mapping": {
        "openai_chat_completions": "unknown",
        "openai_responses": "unknown"
      }
    },
    "top_k": {
      "supported": "unknown",
      "range": "unknown",
      "official_default": "unknown",
      "protocol_mapping": {
        "openai_chat_completions": "unknown",
        "openai_responses": "unknown"
      }
    }
  },
  "embedding": null,
  "evidence": [
    {
      "source_id": "openai-gpt-5.5-model",
      "source_url": "https://developers.openai.com/api/docs/models/gpt-5.5",
      "source_type": "official_docs",
      "retrieved_at": "2026-08-02T00:00:00Z",
      "verified_at": "2026-08-02T00:00:00Z",
      "confidence": "high",
      "redistribution": "unknown",
      "notes": "用于 API 标识、端点、限额、模态与明确能力。"
    },
    {
      "source_id": "openai-gpt-5.5-guidance",
      "source_url": "https://developers.openai.com/api/docs/guides/latest-model?model=gpt-5.5",
      "source_type": "official_docs",
      "retrieved_at": "2026-08-02T00:00:00Z",
      "verified_at": "2026-08-02T00:00:00Z",
      "confidence": "high",
      "redistribution": "unknown",
      "notes": "未从该模型页面取得可靠采样参数支持矩阵，因此全部保留 unknown。"
    },
    {
      "source_id": "project-fde-head",
      "source_url": "urn:git:fses-design-mono:c88e5def41856e42449d52ed6d1b05e6fab09d12",
      "source_type": "project_audit",
      "retrieved_at": "2026-08-02T00:00:00Z",
      "verified_at": "2026-08-02T00:00:00Z",
      "confidence": "high",
      "redistribution": "restricted",
      "notes": "当前项目运行时映射审计。"
    }
  ],
  "field_annotations": {
    "/offering_id": { "runtime_effective": false, "metadata_only": true, "adapter_mapping": null, "unsupported_reason": null, "source_ids": ["openai-gpt-5.5-model"] },
    "/provider_id": { "runtime_effective": true, "metadata_only": false, "adapter_mapping": "ChatOpenAI adapter selection", "unsupported_reason": null, "source_ids": ["openai-gpt-5.5-model", "project-fde-head"] },
    "/canonical_id": { "runtime_effective": false, "metadata_only": true, "adapter_mapping": null, "unsupported_reason": null, "source_ids": ["openai-gpt-5.5-model"] },
    "/api_model_id": { "runtime_effective": true, "metadata_only": false, "adapter_mapping": "ChatOpenAI.model", "unsupported_reason": null, "source_ids": ["openai-gpt-5.5-model", "project-fde-head"] },
    "/name": { "runtime_effective": false, "metadata_only": true, "adapter_mapping": null, "unsupported_reason": null, "source_ids": ["openai-gpt-5.5-model"] },
    "/status": { "runtime_effective": false, "metadata_only": true, "adapter_mapping": null, "unsupported_reason": null, "source_ids": ["openai-gpt-5.5-model"] },
    "/lifecycle/*": { "runtime_effective": false, "metadata_only": true, "adapter_mapping": null, "unsupported_reason": null, "source_ids": ["openai-gpt-5.5-model"] },
    "/protocols": { "runtime_effective": true, "metadata_only": false, "adapter_mapping": "ChatOpenAI.useResponsesApi", "unsupported_reason": "当前 FDE 尚未区分 Chat Completions 与 Responses。", "source_ids": ["openai-gpt-5.5-model", "project-fde-head"] },
    "/limits/max_context_tokens": { "runtime_effective": true, "metadata_only": false, "adapter_mapping": "current FDE model.profile.maxInputTokens (semantic mismatch)", "unsupported_reason": "不得继续把 context 当 input。", "source_ids": ["openai-gpt-5.5-model", "project-fde-head"] },
    "/limits/max_input_tokens": { "runtime_effective": false, "metadata_only": false, "adapter_mapping": "DeepAgent model.profile.maxInputTokens", "unsupported_reason": "可靠值缺失，必须 fail closed 或显式 override。", "source_ids": ["openai-gpt-5.5-model", "project-fde-head"] },
    "/limits/max_output_tokens": { "runtime_effective": true, "metadata_only": false, "adapter_mapping": "ChatOpenAI.maxTokens", "unsupported_reason": null, "source_ids": ["openai-gpt-5.5-model", "project-fde-head"] },
    "/modalities/*": { "runtime_effective": false, "metadata_only": false, "adapter_mapping": "FDE role/content validation", "unsupported_reason": "当前仅消费粗粒度 modelType。", "source_ids": ["openai-gpt-5.5-model", "project-fde-head"] },
    "/capabilities/agent/*": { "runtime_effective": false, "metadata_only": false, "adapter_mapping": "ChatOpenAI constructor/call options and DeepAgent admission", "unsupported_reason": "当前 FDE 未消费细粒度能力，streaming 为硬编码。", "source_ids": ["openai-gpt-5.5-model", "project-fde-head"] },
    "/capabilities/agent/tool_call": { "runtime_effective": true, "metadata_only": false, "adapter_mapping": "current coarse functionCallSupport admission gate", "unsupported_reason": "当前仅粗粒度生效。", "source_ids": ["openai-gpt-5.5-model", "project-fde-head"] },
    "/capabilities/reasoning/supported": { "runtime_effective": false, "metadata_only": true, "adapter_mapping": null, "unsupported_reason": null, "source_ids": ["openai-gpt-5.5-guidance", "project-fde-head"] },
    "/capabilities/reasoning/*": { "runtime_effective": false, "metadata_only": false, "adapter_mapping": "ChatOpenAI.reasoning / reasoningEffort protocol mapping", "unsupported_reason": "当前 FDE 未构造 reasoning 参数。", "source_ids": ["openai-gpt-5.5-guidance", "project-fde-head"] },
    "/sampling_parameters/*": { "runtime_effective": false, "metadata_only": false, "adapter_mapping": "three-layer policy merge then ChatOpenAI constructor filtering", "unsupported_reason": "当前 temperature/topP 虽被数据库保存和下发，但 FDE 构造器未消费；unknown 必须省略。", "source_ids": ["openai-gpt-5.5-guidance", "project-fde-head"] },
    "/embedding": { "runtime_effective": false, "metadata_only": true, "adapter_mapping": null, "unsupported_reason": null, "source_ids": ["openai-gpt-5.5-model"] }
  }
}
